{
  "type": "rankingRoom",
  "active": true,
  "facilitatorId": "1d4e5f60-7a8b-4c9d-8e0f-1a2b3c4d5e6f",
  "live": true,
  "draft": {
    "criterionKeys": ["bv", "js"],
    "criterionKey": "bv",
    "levels": [
      ["6f1c2d3e-4b5a-4c7d-8e9f-0a1b2c3d4e5f"],
      ["7a2d3e4f-5c6b-4d8e-9fa0-1b2c3d4e5f60", "8b3e4f50-6d7c-4e9f-8a01-2c3d4e5f6071"]
    ],
    "unranked": [],
    "values": {
      "6f1c2d3e-4b5a-4c7d-8e9f-0a1b2c3d4e5f": 8,
      "7a2d3e4f-5c6b-4d8e-9fa0-1b2c3d4e5f60": 5,
      "8b3e4f50-6d7c-4e9f-8a01-2c3d4e5f6071": 5
    }
  },
  "opinions": [
    {
      "featureId": "6f1c2d3e-4b5a-4c7d-8e9f-0a1b2c3d4e5f",
      "criterionKey": "bv",
      "participantId": "2e5f6071-8b9c-4dae-9f10-2b3c4d5e6f70",
      "opinion": "AGREE"
    },
    {
      "featureId": "7a2d3e4f-5c6b-4d8e-9fa0-1b2c3d4e5f60",
      "criterionKey": "bv",
      "participantId": "2e5f6071-8b9c-4dae-9f10-2b3c4d5e6f70",
      "opinion": "RAISE",
      "comment": "Le salon de mars impose la nouvelle recherche.",
      "value": 8
    },
    {
      "featureId": "7a2d3e4f-5c6b-4d8e-9fa0-1b2c3d4e5f60",
      "criterionKey": "bv",
      "participantId": "3f607182-9cad-4ebf-8a21-3c4d5e6f7081",
      "opinion": "LOWER",
      "value": 3
    }
  ],
  "spotlightFeatureId": "7a2d3e4f-5c6b-4d8e-9fa0-1b2c3d4e5f60"
}
